[
  {
    "id": "lions-of-the-emperor",
    "name": "Lions of the Emperor",
    "faction_id": "adeptus-custodes",
    "detachment_rule_id": "against-all-odds",
    "enhancement_ids": [
      "superior-creation-lions-of-the-emperor",
      "praesidius-lions-of-the-emperor",
      "fierce-conqueror-lions-of-the-emperor",
      "admonimortis-lions-of-the-emperor"
    ],
    "stratagem_ids": [
      "peerless-warrior-lions-of-the-emperor",
      "gilded-champion-lions-of-the-emperor",
      "defiant-to-the-last-lions-of-the-emperor",
      "unleash-the-lions-lions-of-the-emperor",
      "manoeuvre-and-fire-lions-of-the-emperor",
      "swift-as-the-eagle-lions-of-the-emperor"
    ],
    "game_version": {
      "edition": "11th",
      "dataslate": "pre-launch-provisional"
    },
    "detachment_points": 3,
    "force_dispositions": [
      "take-and-hold"
    ],
    "tags": [
      "lions"
    ],
    "external_refs": [
      {
        "namespace": "mfm",
        "id": "16f0256d-a6ba-4d12-963f-2b8874eb17a5"
      }
    ]
  },
  {
    "id": "auric-champions",
    "name": "Auric Champions",
    "faction_id": "adeptus-custodes",
    "detachment_rule_id": "assemblage-of-might",
    "enhancement_ids": [
      "blade-imperator-auric-champions",
      "inspirational-exemplar-auric-champions",
      "veiled-blade-auric-champions",
      "martial-philosopher-auric-champions"
    ],
    "stratagem_ids": [
      "slayer-of-champions-auric-champions",
      "the-emperors-auspice-auric-champions",
      "earning-of-a-name-auric-champions",
      "shoulder-the-mantle-auric-champions",
      "superhuman-reserves-auric-champions",
      "vigil-unending-auric-champions"
    ],
    "game_version": {
      "edition": "11th",
      "dataslate": "pre-launch-provisional"
    },
    "detachment_points": 2,
    "force_dispositions": [
      "priority-assets"
    ],
    "external_refs": [
      {
        "namespace": "mfm",
        "id": "2ed9481a-9f80-4e78-8931-b8070fef82e3"
      }
    ]
  },
  {
    "id": "solar-spearhead",
    "name": "Solar Spearhead",
    "faction_id": "adeptus-custodes",
    "detachment_rule_id": null,
    "enhancement_ids": [
      "adamantine-talisman-solar-spearhead",
      "augury-uplink-solar-spearhead",
      "honoured-fallen-aura-solar-spearhead",
      "veteran-of-the-kataphraktoi-solar-spearhead"
    ],
    "stratagem_ids": [
      "flawless-construction-solar-spearhead",
      "emperors-vengeance-solar-spearhead",
      "wrathful-advance-solar-spearhead",
      "unstoppable-solar-spearhead",
      "relentless-persecution-solar-spearhead",
      "punishment-inescapable-solar-spearhead"
    ],
    "game_version": {
      "edition": "11th",
      "dataslate": "pre-launch-provisional"
    },
    "detachment_points": 2,
    "force_dispositions": [
      "take-and-hold"
    ],
    "detachment_rule_ids": [
      "auric-armour",
      "moritoi-ancients"
    ],
    "tags": [
      "armoury"
    ],
    "external_refs": [
      {
        "namespace": "mfm",
        "id": "3cb02267-28e0-4dab-9ff3-976caa1b7a31"
      }
    ]
  },
  {
    "id": "shield-host",
    "name": "Shield Host",
    "faction_id": "adeptus-custodes",
    "detachment_rule_id": "martial-mastery",
    "enhancement_ids": [
      "from-the-hall-of-armouries-shield-host",
      "castellans-mark-shield-host",
      "auric-mantle-shield-host",
      "panoptispex-shield-host"
    ],
    "stratagem_ids": [
      "arcane-genetic-alchemy-shield-host",
      "avenge-the-fallen-shield-host",
      "unwavering-sentinels-shield-host",
      "multipotentiality-shield-host",
      "vigilance-eternal-shield-host",
      "archeotech-munitions-shield-host"
    ],
    "game_version": {
      "edition": "11th",
      "dataslate": "pre-launch-provisional"
    },
    "detachment_points": 2,
    "force_dispositions": [
      "purge-the-foe"
    ],
    "external_refs": [
      {
        "namespace": "mfm",
        "id": "71a22085-3750-4339-bd18-7b7511e831ee"
      }
    ]
  },
  {
    "id": "null-maiden-vigil",
    "name": "Null Maiden Vigil",
    "faction_id": "adeptus-custodes",
    "detachment_rule_id": "creeping-dread-aura",
    "enhancement_ids": [
      "raptor-blade-null-maiden-vigil",
      "enhanced-voidsheen-cloak-null-maiden-vigil",
      "huntress-eye-null-maiden-vigil",
      "oblivion-knight-null-maiden-vigil"
    ],
    "stratagem_ids": [
      "witch-hunters-null-maiden-vigil",
      "anathema-blademastery-null-maiden-vigil",
      "purgation-sweep-null-maiden-vigil",
      "desperations-price-null-maiden-vigil",
      "psy-chaff-volley-null-maiden-vigil",
      "psychic-abominations-null-maiden-vigil"
    ],
    "game_version": {
      "edition": "11th",
      "dataslate": "pre-launch-provisional"
    },
    "detachment_points": 2,
    "force_dispositions": [
      "reconnaissance"
    ],
    "external_refs": [
      {
        "namespace": "mfm",
        "id": "b70a6b14-333a-4f04-a3c3-b3341e48c08c"
      }
    ]
  },
  {
    "id": "talons-of-the-emperor",
    "name": "Talons of the Emperor",
    "faction_id": "adeptus-custodes",
    "detachment_rule_id": "revered-companions",
    "enhancement_ids": [
      "radiant-mantle-talons-of-the-emperor",
      "gift-of-terran-artifice-talons-of-the-emperor",
      "champion-of-the-imperium-talons-of-the-emperor",
      "aegis-projector-talons-of-the-emperor"
    ],
    "stratagem_ids": [
      "talons-interlocked-talons-of-the-emperor",
      "empyric-severance-talons-of-the-emperor",
      "taloned-pincer-talons-of-the-emperor",
      "emperors-executioners-talons-of-the-emperor",
      "shield-of-honour-talons-of-the-emperor",
      "hunt-as-one-talons-of-the-emperor"
    ],
    "game_version": {
      "edition": "11th",
      "dataslate": "pre-launch-provisional"
    },
    "detachment_points": 3,
    "force_dispositions": [
      "take-and-hold"
    ],
    "external_refs": [
      {
        "namespace": "mfm",
        "id": "f0e490e7-c6e3-4c51-9162-93dca988eee5"
      }
    ]
  },
  {
    "id": "might-of-the-moritoi",
    "name": "Might of the Moritoi",
    "faction_id": "adeptus-custodes",
    "detachment_rule_id": "march-of-the-honoured-dead",
    "enhancement_ids": [
      "interred-expertise-upgrade-might-of-the-moritoi",
      "auramite-sarcophagus-upgrade-might-of-the-moritoi"
    ],
    "stratagem_ids": [
      "flawless-construction-might-of-the-moritoi",
      "unstoppable-advance-might-of-the-moritoi",
      "prioritised-eradication-might-of-the-moritoi"
    ],
    "game_version": {
      "edition": "11th",
      "dataslate": "pre-launch-provisional"
    },
    "detachment_points": 1,
    "force_dispositions": [
      "take-and-hold"
    ],
    "tags": [
      "armoury"
    ],
    "external_refs": [
      {
        "namespace": "mfm",
        "id": "4edac749-d510-4161-b3c3-1fd31e91cfcf"
      }
    ]
  },
  {
    "id": "silent-hunters",
    "name": "Silent Hunters",
    "faction_id": "adeptus-custodes",
    "detachment_rule_id": "skin-crawling-disorientation",
    "enhancement_ids": [
      "encircling-hunter-silent-hunters",
      "psyk-out-grenades-upgrade-silent-hunters"
    ],
    "stratagem_ids": [
      "deathsong-scythes-silent-hunters",
      "umbral-prosecution-silent-hunters",
      "synchronised-inferno-silent-hunters"
    ],
    "game_version": {
      "edition": "11th",
      "dataslate": "pre-launch-provisional"
    },
    "detachment_points": 1,
    "force_dispositions": [
      "reconnaissance"
    ],
    "external_refs": [
      {
        "namespace": "mfm",
        "id": "58dd1c38-27e6-4ccf-a7f5-53068e61b838"
      }
    ]
  },
  {
    "id": "tharanatoi-hammerblow",
    "name": "Tharanatoi Hammerblow",
    "faction_id": "adeptus-custodes",
    "detachment_rule_id": "the-hammer-falls",
    "enhancement_ids": [
      "mnemo-locked-shrine-cipher-tharanatoi-hammerblow",
      "efficient-aggression-tharanatoi-hammerblow"
    ],
    "stratagem_ids": [
      "hardened-resolve-tharanatoi-hammerblow",
      "unleash-the-lions-tharanatoi-hammerblow",
      "electroexorcist-saturation-tharanatoi-hammerblow"
    ],
    "game_version": {
      "edition": "11th",
      "dataslate": "pre-launch-provisional"
    },
    "detachment_points": 1,
    "force_dispositions": [
      "disruption"
    ],
    "tags": [
      "lions"
    ],
    "external_refs": [
      {
        "namespace": "mfm",
        "id": "92ae3afb-c5d5-41a9-80da-8db33c91ed41"
      }
    ]
  },
  {
    "id": "tristraens-gilded-blades",
    "name": "Tristraen’s Gilded Blades",
    "faction_id": "adeptus-custodes",
    "enhancement_ids": [
      "comrades-in-wrath-tristraens-gilded-blades",
      "shattering-charge-tristraens-gilded-blades"
    ],
    "game_version": {
      "edition": "11th",
      "dataslate": "launch"
    },
    "game_modes": [
      "combat-patrol"
    ],
    "detachment_points": 1,
    "force_dispositions": [
      "take-and-hold"
    ],
    "external_refs": [
      {
        "namespace": "mfm",
        "id": "9c579f51-d8f2-461a-8a99-ec7deace8303"
      }
    ]
  }
]
