[
  {
    "id": "haloscreed-battle-clade",
    "name": "Haloscreed Battle Clade",
    "faction_id": "adeptus-mechanicus",
    "detachment_rule_id": "noospheric-transference",
    "enhancement_ids": [
      "transoracular-dyad-wafers-haloscreed-battle-clade",
      "cognitive-reinforcement-haloscreed-battle-clade",
      "sanctified-ordnance-haloscreed-battle-clade",
      "inloaded-lethality-haloscreed-battle-clade"
    ],
    "stratagem_ids": [
      "eradication-protocols-haloscreed-battle-clade",
      "targeting-override-haloscreed-battle-clade",
      "guided-retreat-haloscreed-battle-clade",
      "neural-overload-haloscreed-battle-clade",
      "aggressive-impulse-haloscreed-battle-clade",
      "analytical-divination-haloscreed-battle-clade"
    ],
    "game_version": {
      "edition": "11th",
      "dataslate": "pre-launch-provisional"
    },
    "detachment_points": 3,
    "force_dispositions": [
      "priority-assets"
    ]
  },
  {
    "id": "cohort-cybernetica",
    "name": "Cohort Cybernetica",
    "faction_id": "adeptus-mechanicus",
    "detachment_rule_id": "cyber-psalm-programming",
    "enhancement_ids": [
      "necromechanic-cohort-cybernetica",
      "lord-of-machines-cohort-cybernetica",
      "emotionless-clarity-cohort-cybernetica",
      "arch-negator-cohort-cybernetica"
    ],
    "stratagem_ids": [
      "motive-imperative-cohort-cybernetica",
      "auto-divinatory-targeting-cohort-cybernetica",
      "benevolence-of-the-omnissiah-cohort-cybernetica",
      "machine-spirit-resurgent-cohort-cybernetica",
      "machine-superiority-cohort-cybernetica",
      "transcendent-cogitation-cohort-cybernetica"
    ],
    "game_version": {
      "edition": "11th",
      "dataslate": "pre-launch-provisional"
    },
    "detachment_points": 2,
    "force_dispositions": [
      "take-and-hold"
    ]
  },
  {
    "id": "skitarii-hunter-cohort",
    "name": "Skitarii Hunter Cohort",
    "faction_id": "adeptus-mechanicus",
    "detachment_rule_id": "stealth-optimisation",
    "enhancement_ids": [
      "cantic-thrallnet-skitarii-hunter-cohort",
      "clandestine-infiltrator-skitarii-hunter-cohort",
      "veiled-hunter-skitarii-hunter-cohort",
      "battle-sphere-uplink-skitarii-hunter-cohort"
    ],
    "stratagem_ids": [
      "isolate-and-destroy-skitarii-hunter-cohort",
      "shroud-protocols-skitarii-hunter-cohort",
      "programmed-withdrawal-skitarii-hunter-cohort",
      "bionic-endurance-skitarii-hunter-cohort",
      "expedited-purge-protocol-skitarii-hunter-cohort",
      "binharic-offence-skitarii-hunter-cohort"
    ],
    "game_version": {
      "edition": "11th",
      "dataslate": "pre-launch-provisional"
    },
    "detachment_points": 2,
    "force_dispositions": [
      "reconnaissance"
    ]
  },
  {
    "id": "data-psalm-conclave",
    "name": "Data-psalm Conclave",
    "faction_id": "adeptus-mechanicus",
    "detachment_rule_id": "benedictions-of-the-omnissiah",
    "enhancement_ids": [
      "mechanicus-locum-data-psalm-conclave",
      "mantle-of-the-gnosticarch-data-psalm-conclave",
      "data-blessed-autosermon-data-psalm-conclave",
      "temporcopia-data-psalm-conclave"
    ],
    "stratagem_ids": [
      "incantation-of-the-iron-soul-data-psalm-conclave",
      "chant-of-the-remorseless-fist-data-psalm-conclave",
      "luminescent-blessing-data-psalm-conclave",
      "verse-of-vengeance-data-psalm-conclave",
      "tribute-of-emphatic-veneration-data-psalm-conclave",
      "litany-of-the-electromancer-data-psalm-conclave"
    ],
    "game_version": {
      "edition": "11th",
      "dataslate": "pre-launch-provisional"
    },
    "detachment_points": 2,
    "force_dispositions": [
      "disruption"
    ],
    "tags": [
      "data-psalm"
    ]
  },
  {
    "id": "explorator-maniple",
    "name": "Explorator Maniple",
    "faction_id": "adeptus-mechanicus",
    "detachment_rule_id": "acquisition-at-any-cost",
    "enhancement_ids": [
      "magos-explorator-maniple",
      "genetor-explorator-maniple",
      "logis-explorator-maniple",
      "artisan-explorator-maniple"
    ],
    "stratagem_ids": [
      "priority-reclamation-explorator-maniple",
      "auto-oracular-retrieval-explorator-maniple",
      "cached-acquisition-explorator-maniple",
      "reactive-safeguard-explorator-maniple",
      "infoslave-skull-explorator-maniple",
      "incense-exhausts-explorator-maniple"
    ],
    "game_version": {
      "edition": "11th",
      "dataslate": "pre-launch-provisional"
    },
    "detachment_points": 2,
    "force_dispositions": [
      "priority-assets"
    ]
  },
  {
    "id": "rad-zone-corps",
    "name": "Rad-Zone Corps",
    "faction_id": "adeptus-mechanicus",
    "detachment_rule_id": "rad-bombardment",
    "enhancement_ids": [
      "radial-suffusion-rad-zone-corps",
      "malphonic-susurrus-rad-zone-corps",
      "peerless-eradicator-rad-zone-corps",
      "autoclavic-denunciation-rad-zone-corps"
    ],
    "stratagem_ids": [
      "aggressor-imperative-rad-zone-corps",
      "pre-calibrated-purge-solution-rad-zone-corps",
      "baleful-halo-rad-zone-corps",
      "bulwark-imperative-rad-zone-corps",
      "extinction-order-rad-zone-corps",
      "lethal-dosage-rad-zone-corps"
    ],
    "game_version": {
      "edition": "11th",
      "dataslate": "pre-launch-provisional"
    },
    "detachment_points": 2,
    "force_dispositions": [
      "take-and-hold"
    ]
  },
  {
    "id": "cohort-acquisitus",
    "name": "Cohort Acquisitus",
    "faction_id": "adeptus-mechanicus",
    "detachment_rule_id": "noospheric-recon",
    "enhancement_ids": [
      "explorator-dispensation-cohort-acquisitus",
      "stealth-screened-cybercanids-upgrade-cohort-acquisitus"
    ],
    "stratagem_ids": [
      "defect-scrutiny-cohort-acquisitus",
      "repolarised-augurs-cohort-acquisitus",
      "clandestine-reposition-cohort-acquisitus"
    ],
    "game_version": {
      "edition": "11th",
      "dataslate": "pre-launch-provisional"
    },
    "detachment_points": 1,
    "force_dispositions": [
      "reconnaissance"
    ]
  },
  {
    "id": "lords-of-the-forge",
    "name": "Lords of the Forge",
    "faction_id": "adeptus-mechanicus",
    "detachment_rule_id": "war-form-mantles",
    "enhancement_ids": [
      "vinghs-wafers-of-dynamism-lords-of-the-forge",
      "tl-4-9-lords-of-the-forge"
    ],
    "stratagem_ids": [
      "scriptural-prognosis-lords-of-the-forge",
      "overloaded-safeguards-lords-of-the-forge",
      "holy-avarice-lords-of-the-forge"
    ],
    "game_version": {
      "edition": "11th",
      "dataslate": "pre-launch-provisional"
    },
    "detachment_points": 1,
    "force_dispositions": [
      "priority-assets"
    ],
    "tags": []
  },
  {
    "id": "luminen-auto-choir",
    "name": "Luminen Auto-choir",
    "faction_id": "adeptus-mechanicus",
    "detachment_rule_id": "cyber-static-canticles",
    "enhancement_ids": [
      "voltagheist-reliquary-luminen-auto-choir",
      "electromiasmic-brazier-luminen-auto-choir"
    ],
    "stratagem_ids": [
      "echoes-of-the-conduit-wars-luminen-auto-choir",
      "chant-of-electrotraction-luminen-auto-choir",
      "momentum-feedback-luminen-auto-choir"
    ],
    "game_version": {
      "edition": "11th",
      "dataslate": "pre-launch-provisional"
    },
    "detachment_points": 1,
    "force_dispositions": [
      "disruption"
    ],
    "tags": [
      "data-psalm"
    ]
  },
  {
    "id": "eradication-cohort",
    "name": "Eradication Cohort",
    "faction_id": "adeptus-mechanicus",
    "detachment_rule_id": "murderous-imperative",
    "enhancement_ids": [
      "omnicogitator-eradication-cohort",
      "martial-signatum-amplificator-eradication-cohort",
      "belicosa-class-capacitor-vanes-eradication-cohort",
      "omnissiahs-fury-eradication-cohort"
    ],
    "stratagem_ids": [
      "servo-driven-charge-eradication-cohort",
      "threat-cogitation-targeters-eradication-cohort",
      "unrelenting-aggression-eradication-cohort",
      "precision-onslaught-eradication-cohort",
      "unshackled-wrath-eradication-cohort",
      "analytic-reprisals-eradication-cohort"
    ],
    "game_version": {
      "edition": "11th",
      "dataslate": "pre-launch-provisional"
    },
    "detachment_points": 3,
    "force_dispositions": [
      "purge-the-foe"
    ]
  },
  {
    "id": "purge-corps-deltic-9",
    "name": "Purge Corps Deltic-9",
    "faction_id": "adeptus-mechanicus",
    "enhancement_ids": [
      "empowered-mechanisms-purge-corps-deltic-9",
      "miniaturised-autosimulacra-purge-corps-deltic-9"
    ],
    "game_version": {
      "edition": "11th",
      "dataslate": "launch"
    },
    "game_modes": [
      "combat-patrol"
    ],
    "detachment_points": 1,
    "force_dispositions": [
      "purge-the-foe"
    ]
  }
]
