[
  {
    "id": "augurium-task-force",
    "name": "Augurium Task Force",
    "faction_id": "grey-knights",
    "detachment_rule_id": "prescient-redeployment",
    "enhancement_ids": [
      "grimoire-of-conjunctions-augurium-task-force",
      "shield-of-prophecy-augurium-task-force",
      "one-foot-in-the-future-augurium-task-force",
      "doomseers-amulet-augurium-task-force"
    ],
    "stratagem_ids": [
      "aggressive-anticipation-augurium-task-force",
      "appointed-hour-augurium-task-force",
      "forewarned-evasion-augurium-task-force",
      "necessary-end-augurium-task-force",
      "redirected-strike-augurium-task-force",
      "mirage-of-echoes-augurium-task-force"
    ],
    "game_version": {
      "edition": "11th",
      "dataslate": "pre-launch-provisional"
    },
    "detachment_points": 2,
    "force_dispositions": [
      "reconnaissance"
    ]
  },
  {
    "id": "banishers",
    "name": "Banishers",
    "faction_id": "grey-knights",
    "detachment_rule_id": "channelled-force",
    "enhancement_ids": [
      "sigil-of-the-hunt-banishers",
      "ephemeral-tome-banishers",
      "sixty-sixth-seal-banishers",
      "pyresoul-psychic-banishers"
    ],
    "stratagem_ids": [
      "hexwrought-reprisal-banishers",
      "warding-chant-banishers",
      "chaos-bane-banishers",
      "celerity-banishers",
      "circle-of-sanctuary-banishers",
      "shadow-of-anarch-banishers"
    ],
    "game_version": {
      "edition": "11th",
      "dataslate": "pre-launch-provisional"
    },
    "detachment_points": 2,
    "force_dispositions": [
      "disruption"
    ]
  },
  {
    "id": "warpbane-task-force",
    "name": "Warpbane Task Force",
    "faction_id": "grey-knights",
    "detachment_rule_id": "hallowed-ground",
    "enhancement_ids": [
      "mandulian-reliquary-warpbane-task-force",
      "radiant-champion-warpbane-task-force",
      "phial-of-the-abyss-warpbane-task-force",
      "paragon-of-sanctity-warpbane-task-force"
    ],
    "stratagem_ids": [
      "sanctified-kill-zone-warpbane-task-force",
      "fires-of-covenant-warpbane-task-force",
      "flames-of-sanctity-warpbane-task-force",
      "aegis-eternal-warpbane-task-force",
      "hallowed-beacon-warpbane-task-force",
      "repelling-sphere-warpbane-task-force"
    ],
    "game_version": {
      "edition": "11th",
      "dataslate": "pre-launch-provisional"
    },
    "detachment_points": 3,
    "force_dispositions": [
      "take-and-hold"
    ]
  },
  {
    "id": "brotherhood-strike",
    "name": "Brotherhood Strike",
    "faction_id": "grey-knights",
    "detachment_rule_id": "fury-of-titan",
    "enhancement_ids": [
      "banishing-wave-psychic-brotherhood-strike",
      "blinding-aura-brotherhood-strike",
      "purity-of-purpose-brotherhood-strike",
      "tome-of-forbidden-ways-brotherhood-strike"
    ],
    "stratagem_ids": [
      "purgation-pattern-brotherhood-strike",
      "shining-veil-brotherhood-strike",
      "combat-manifestation-brotherhood-strike",
      "duty-unending-brotherhood-strike",
      "truesilver-channelling-brotherhood-strike",
      "expeditious-exit-brotherhood-strike"
    ],
    "game_version": {
      "edition": "11th",
      "dataslate": "pre-launch-provisional"
    },
    "detachment_points": 2,
    "force_dispositions": [
      "purge-the-foe"
    ]
  },
  {
    "id": "hallowed-conclave",
    "name": "Hallowed Conclave",
    "faction_id": "grey-knights",
    "detachment_rule_id": "duty-before-all",
    "enhancement_ids": [
      "eye-of-the-augurim-hallowed-conclave",
      "inescapable-judgement-psychic-hallowed-conclave",
      "sanctic-reaper-hallowed-conclave",
      "nemesis-rounds-hallowed-conclave",
      "eye-of-the-augurium-hallowed-conclave"
    ],
    "stratagem_ids": [
      "giants-of-the-battlefield-hallowed-conclave",
      "unending-fidelity-hallowed-conclave",
      "point-blank-purgation-hallowed-conclave",
      "grind-them-underfoot-hallowed-conclave",
      "precognitive-strategies-hallowed-conclave",
      "shining-resolve-hallowed-conclave"
    ],
    "game_version": {
      "edition": "11th",
      "dataslate": "pre-launch-provisional"
    },
    "detachment_points": 2,
    "force_dispositions": [
      "take-and-hold"
    ]
  },
  {
    "id": "sanctic-spearhead",
    "name": "Sanctic Spearhead",
    "faction_id": "grey-knights",
    "detachment_rule_id": "mailed-fist",
    "enhancement_ids": [
      "driven-by-duty-sanctic-spearhead",
      "quickening-foci-sanctic-spearhead",
      "sigil-of-exigence-sanctic-spearhead",
      "spiritus-machina-sanctic-spearhead"
    ],
    "stratagem_ids": [
      "abominus-class-targets-sanctic-spearhead",
      "truesilver-will-sanctic-spearhead",
      "armoured-aegis-sanctic-spearhead",
      "redoubled-assault-sanctic-spearhead",
      "force-wave-sanctic-spearhead",
      "argent-wrath-sanctic-spearhead"
    ],
    "game_version": {
      "edition": "11th",
      "dataslate": "pre-launch-provisional"
    },
    "detachment_points": 2,
    "force_dispositions": [
      "priority-assets"
    ]
  },
  {
    "id": "argent-assault",
    "name": "Argent Assault",
    "faction_id": "grey-knights",
    "detachment_rule_id": "dauntless-champions",
    "enhancement_ids": [
      "psychic-celerity-argent-assault",
      "vigilance-of-titan-argent-assault"
    ],
    "stratagem_ids": [
      "truesilver-aegis-argent-assault",
      "a-threat-ended-argent-assault",
      "aura-of-vengeance-argent-assault"
    ],
    "game_version": {
      "edition": "11th",
      "dataslate": "pre-launch-provisional"
    },
    "detachment_points": 1,
    "force_dispositions": [
      "priority-assets"
    ]
  },
  {
    "id": "fires-of-purgation",
    "name": "Fires of Purgation",
    "faction_id": "grey-knights",
    "detachment_rule_id": "searing-soulflame",
    "enhancement_ids": [
      "precognicient-volleys-upgrade-fires-of-purgation",
      "boons-of-deimos-upgrade-fires-of-purgation"
    ],
    "stratagem_ids": [
      "soul-locked-fires-of-purgation",
      "focused-immolation-fires-of-purgation",
      "spiritsear-fires-of-purgation"
    ],
    "game_version": {
      "edition": "11th",
      "dataslate": "pre-launch-provisional"
    },
    "detachment_points": 1,
    "force_dispositions": [
      "disruption"
    ]
  },
  {
    "id": "immaterial-interdiction",
    "name": "Immaterial Interdiction",
    "faction_id": "grey-knights",
    "detachment_rule_id": "echojump",
    "enhancement_ids": [
      "predestined-coordinates-upgrade-immaterial-interdiction",
      "astral-overlap-upgrade-immaterial-interdiction"
    ],
    "stratagem_ids": [
      "blades-from-the-beyond-immaterial-interdiction",
      "by-thought-alone-immaterial-interdiction",
      "responsive-displacement-immaterial-interdiction"
    ],
    "game_version": {
      "edition": "11th",
      "dataslate": "pre-launch-provisional"
    },
    "detachment_points": 1,
    "force_dispositions": [
      "reconnaissance"
    ]
  },
  {
    "id": "crowes-sanctifiers",
    "name": "Crowe’s Sanctifiers",
    "faction_id": "grey-knights",
    "enhancement_ids": [
      "purifying-force-crowes-sanctifiers",
      "sanctified-auspexes-crowes-sanctifiers"
    ],
    "game_version": {
      "edition": "11th",
      "dataslate": "launch"
    },
    "game_modes": [
      "combat-patrol"
    ],
    "detachment_points": 1,
    "force_dispositions": [
      "priority-assets"
    ]
  }
]
