[
  {
    "id": "iconoclast-fiefdom",
    "name": "Iconoclast Fiefdom",
    "faction_id": "chaos-knights",
    "detachment_rule_id": "wretched-thralls",
    "enhancement_ids": [
      "cruel-lashmaster-aura-iconoclast-fiefdom",
      "iconoclast-idol-aura-iconoclast-fiefdom"
    ],
    "stratagem_ids": [
      "avenge-the-masters-iconoclast-fiefdom",
      "dark-sacrifice-iconoclast-fiefdom",
      "coursing-thralls-iconoclast-fiefdom"
    ],
    "game_version": {
      "edition": "11th",
      "dataslate": "pre-launch-provisional"
    },
    "detachment_points": 1,
    "force_dispositions": [
      "take-and-hold"
    ],
    "external_refs": [
      {
        "namespace": "mfm",
        "id": "c7d24ce3-acdf-414d-af2a-81c602983045"
      }
    ]
  },
  {
    "id": "lords-of-dread",
    "name": "Lords of Dread",
    "faction_id": "chaos-knights",
    "detachment_rule_id": "tyrannical-court",
    "enhancement_ids": [
      "throne-mechanicum-of-skulls-lords-of-dread",
      "blade-of-celerity-lords-of-dread",
      "warp-borne-stalker-lords-of-dread",
      "putrid-carapace-lords-of-dread",
      "mirror-of-fates-lords-of-dread",
      "blessing-of-the-dark-master-lords-of-dread"
    ],
    "stratagem_ids": [
      "claimed-for-the-dark-gods-lords-of-dread",
      "spiteful-demise-lords-of-dread",
      "titanic-duel-lords-of-dread",
      "trophy-hunter-lords-of-dread",
      "crushed-like-vermin-lords-of-dread",
      "runes-of-disdain-lords-of-dread"
    ],
    "game_version": {
      "edition": "11th",
      "dataslate": "pre-launch-provisional"
    },
    "detachment_points": 2,
    "force_dispositions": [
      "take-and-hold"
    ],
    "external_refs": [
      {
        "namespace": "mfm",
        "id": "355721a8-7f31-4a55-94e0-cbc895fb2397"
      }
    ]
  },
  {
    "id": "infernal-lance",
    "name": "Infernal Lance",
    "faction_id": "chaos-knights",
    "detachment_rule_id": "malefic-surge",
    "enhancement_ids": [
      "knight-diabolus-infernal-lance",
      "blasphemous-engine-infernal-lance",
      "fleshmetal-fusion-infernal-lance",
      "bestial-aspect-infernal-lance"
    ],
    "stratagem_ids": [
      "profane-symbiosis-infernal-lance",
      "hellforged-construction-infernal-lance",
      "corrupting-taint-infernal-lance",
      "unleash-balefire-infernal-lance",
      "warp-vision-infernal-lance",
      "diabolic-bulwark-infernal-lance"
    ],
    "game_version": {
      "edition": "11th",
      "dataslate": "pre-launch-provisional"
    },
    "detachment_points": 3,
    "force_dispositions": [
      "priority-assets"
    ],
    "external_refs": [
      {
        "namespace": "mfm",
        "id": "86620542-e27d-4e99-a70e-da69a673c9fb"
      }
    ]
  },
  {
    "id": "houndpack-lance",
    "name": "Houndpack Lance",
    "faction_id": "chaos-knights",
    "detachment_rule_id": "marked-prey",
    "enhancement_ids": [
      "preyslayers-mantle-houndpack-lance",
      "final-howl-aura-houndpack-lance",
      "loping-predator-houndpack-lance",
      "panoply-of-the-cursed-knights-houndpack-lance"
    ],
    "stratagem_ids": [
      "hungry-for-combat-houndpack-lance",
      "animalistic-rage-houndpack-lance",
      "vox-howl-houndpack-lance",
      "cunning-hunter-houndpack-lance",
      "harrying-hounds-houndpack-lance",
      "encircling-pack-houndpack-lance"
    ],
    "game_version": {
      "edition": "11th",
      "dataslate": "pre-launch-provisional"
    },
    "detachment_points": 2,
    "force_dispositions": [
      "reconnaissance"
    ],
    "granted_keywords": [
      {
        "keyword": "Battleline",
        "to_keywords": [
          "War Dog"
        ]
      },
      {
        "keyword": "Character",
        "to_keywords": [
          "War Dog"
        ],
        "max_selected": 3
      }
    ],
    "unit_minimums": [
      {
        "keyword": "War Dog",
        "min": 3
      }
    ],
    "tags": [],
    "external_refs": [
      {
        "namespace": "mfm",
        "id": "a634e475-384b-40cd-957d-cd99201ab3e4"
      }
    ]
  },
  {
    "id": "traitoris-lance",
    "name": "Traitoris Lance",
    "faction_id": "chaos-knights",
    "detachment_rule_id": "paragons-of-terror",
    "enhancement_ids": [
      "nightmares-master-traitoris-lance",
      "tyrants-shadow-traitoris-lance",
      "malevolent-heraldry-traitoris-lance",
      "veil-of-medrengard-traitoris-lance"
    ],
    "stratagem_ids": [
      "conquerors-without-mercy-traitoris-lance",
      "imperious-advance-traitoris-lance",
      "disdain-for-the-weak-traitoris-lance",
      "a-long-leash-traitoris-lance",
      "storm-of-darkness-traitoris-lance",
      "pterrorshades-traitoris-lance"
    ],
    "game_version": {
      "edition": "11th",
      "dataslate": "pre-launch-provisional"
    },
    "detachment_points": 2,
    "force_dispositions": [
      "purge-the-foe"
    ],
    "external_refs": [
      {
        "namespace": "mfm",
        "id": "b40710c8-474d-402d-bb22-9903e280dcff"
      }
    ]
  },
  {
    "id": "bastions-of-tyranny",
    "name": "Bastions of Tyranny",
    "faction_id": "chaos-knights",
    "detachment_rule_id": "annihilate-the-unworthy",
    "enhancement_ids": [
      "pterrorshade-rookery-bastions-of-tyranny",
      "hate-filled-dominion-bastions-of-tyranny"
    ],
    "stratagem_ids": [
      "rune-cursed-stronghold-bastions-of-tyranny",
      "pitiless-focus-bastions-of-tyranny",
      "intimidating-reminder-bastions-of-tyranny"
    ],
    "game_version": {
      "edition": "11th",
      "dataslate": "pre-launch-provisional"
    },
    "detachment_points": 1,
    "force_dispositions": [
      "priority-assets"
    ],
    "external_refs": [
      {
        "namespace": "mfm",
        "id": "993e9b23-3ade-4fb1-bb27-f9270de48978"
      }
    ]
  },
  {
    "id": "hunting-warpack",
    "name": "Hunting Warpack",
    "faction_id": "chaos-knights",
    "detachment_rule_id": "scenting-fear",
    "enhancement_ids": [
      "soul-spoor-auspicator-upgrade-hunting-warpack",
      "snarling-rivalry-upgrade-hunting-warpack"
    ],
    "stratagem_ids": [
      "insensate-bloodthirst-hunting-warpack",
      "leash-of-the-masters-hunting-warpack",
      "stalking-focus-hunting-warpack"
    ],
    "game_version": {
      "edition": "11th",
      "dataslate": "pre-launch-provisional"
    },
    "detachment_points": 1,
    "force_dispositions": [
      "reconnaissance"
    ],
    "tags": [],
    "external_refs": [
      {
        "namespace": "mfm",
        "id": "e2637679-6163-4ea2-93cb-8c5a263ecc33"
      }
    ]
  },
  {
    "id": "helhunt-lance",
    "name": "Helhunt Lance",
    "faction_id": "chaos-knights",
    "detachment_rule_id": "masters-of-the-pack",
    "enhancement_ids": [
      "hunters-helm-helhunt-lance",
      "octagram-of-conjuration-helhunt-lance",
      "throne-tyrannicus-helhunt-lance",
      "aspect-of-the-beast-helhunt-lance"
    ],
    "stratagem_ids": [
      "feral-arrogance-helhunt-lance",
      "merciless-fusillade-helhunt-lance",
      "beasthide-manifestation-helhunt-lance",
      "flush-the-quarry-helhunt-lance",
      "contemptuous-volleys-helhunt-lance",
      "goaded-beast-helhunt-lance"
    ],
    "game_version": {
      "edition": "11th",
      "dataslate": "pre-launch-provisional"
    },
    "detachment_points": 2,
    "force_dispositions": [
      "disruption"
    ],
    "external_refs": [
      {
        "namespace": "mfm",
        "id": "9bef33d0-15fa-49f8-ac91-42496470641d"
      }
    ]
  }
]
