[
  {
    "id": "blood-legion",
    "name": "Blood Legion",
    "faction_id": "chaos-daemons",
    "detachment_rule_id": null,
    "enhancement_ids": [
      "slaughterthirst-aura-blood-legion",
      "furys-cage-blood-legion",
      "brazenmaw-blood-legion",
      "gateway-unto-damnation-blood-legion"
    ],
    "stratagem_ids": [
      "sheathed-in-brass-blood-legion",
      "blood-begets-skulls-blood-legion",
      "wrath-undeniable-blood-legion",
      "gore-hungry-onslaught-blood-legion",
      "skulls-beget-blood-blood-legion",
      "fools-flight-blood-legion"
    ],
    "game_version": {
      "edition": "11th",
      "dataslate": "pre-launch-provisional"
    },
    "detachment_points": 2,
    "force_dispositions": [
      "purge-the-foe"
    ],
    "detachment_rule_ids": [
      "murdercall",
      "blood-tainted"
    ],
    "external_refs": [
      {
        "namespace": "mfm",
        "id": "4489023b-fe35-46d6-9653-4b9f6718aa40"
      }
    ]
  },
  {
    "id": "daemonic-incursion",
    "name": "Daemonic Incursion",
    "faction_id": "chaos-daemons",
    "detachment_rule_id": "warp-rifts",
    "enhancement_ids": [
      "argath-the-king-of-blades-daemonic-incursion",
      "the-everstave-daemonic-incursion",
      "the-endless-gift-daemonic-incursion",
      "soulstealer-daemonic-incursion"
    ],
    "stratagem_ids": [
      "draught-of-terror-daemonic-incursion",
      "the-realm-of-chaos-daemonic-incursion",
      "daemonic-invulnerability-daemonic-incursion",
      "corrupt-realspace-daemonic-incursion",
      "warp-surge-daemonic-incursion",
      "denizens-of-the-warp-daemonic-incursion"
    ],
    "game_version": {
      "edition": "11th",
      "dataslate": "pre-launch-provisional"
    },
    "detachment_points": 3,
    "force_dispositions": [
      "take-and-hold"
    ],
    "external_refs": [
      {
        "namespace": "mfm",
        "id": "5357f63c-7c70-459e-aa3b-1ea9c4ef48bb"
      }
    ]
  },
  {
    "id": "plague-legion",
    "name": "Plague Legion",
    "faction_id": "chaos-daemons",
    "detachment_rule_id": "melancholic-miasma",
    "enhancement_ids": [
      "cankerblight-aura-plague-legion",
      "maggot-maws-plague-legion",
      "droning-shroud-aura-plague-legion",
      "font-of-spores-aura-plague-legion"
    ],
    "stratagem_ids": [
      "seeping-virulence-plague-legion",
      "fever-visions-plague-legion",
      "murkshadows-plague-legion",
      "rot-and-renewal-plague-legion",
      "plague-of-woes-plague-legion",
      "foetid-resurgence-plague-legion"
    ],
    "game_version": {
      "edition": "11th",
      "dataslate": "pre-launch-provisional"
    },
    "detachment_points": 2,
    "force_dispositions": [
      "take-and-hold"
    ],
    "external_refs": [
      {
        "namespace": "mfm",
        "id": "778d3486-9f71-4253-90b9-c7ca150fc011"
      }
    ]
  },
  {
    "id": "shadow-legion",
    "name": "Shadow Legion",
    "faction_id": "chaos-daemons",
    "detachment_rule_id": "first-prince-of-chaos",
    "enhancement_ids": [
      "leaping-shadows-shadow-legion",
      "mantle-of-gloom-aura-shadow-legion",
      "fade-to-darkness-shadow-legion",
      "malice-made-manifest-shadow-legion"
    ],
    "stratagem_ids": [
      "death-denied-shadow-legion",
      "encroaching-darkness-shadow-legion",
      "shade-path-shadow-legion",
      "spiteful-demise-shadow-legion",
      "channelled-wrath-shadow-legion",
      "binding-shadow-shadow-legion"
    ],
    "game_version": {
      "edition": "11th",
      "dataslate": "pre-launch-provisional"
    },
    "detachment_points": 2,
    "force_dispositions": [
      "purge-the-foe"
    ],
    "external_refs": [
      {
        "namespace": "mfm",
        "id": "95dd7e2e-5318-4271-b9dc-38592794539f"
      }
    ]
  },
  {
    "id": "scintillating-legion",
    "name": "Scintillating Legion",
    "faction_id": "chaos-daemons",
    "detachment_rule_id": "fates-in-flux",
    "enhancement_ids": [
      "inescapable-eye-scintillating-legion",
      "infernal-puppeteer-scintillating-legion",
      "neverblade-scintillating-legion",
      "improbable-shield-aura-scintillating-legion"
    ],
    "stratagem_ids": [
      "pyrogenesis-scintillating-legion",
      "impossible-eclipse-scintillating-legion",
      "flickering-reality-scintillating-legion",
      "fateborne-nightmares-scintillating-legion",
      "ficklefire-scintillating-legion",
      "delirium-unmade-scintillating-legion"
    ],
    "game_version": {
      "edition": "11th",
      "dataslate": "pre-launch-provisional"
    },
    "detachment_points": 2,
    "force_dispositions": [
      "priority-assets"
    ],
    "external_refs": [
      {
        "namespace": "mfm",
        "id": "d7d52d0d-d7af-4bc4-9a77-6ca0250a1d2c"
      }
    ]
  },
  {
    "id": "legion-of-excess",
    "name": "Legion of Excess",
    "faction_id": "chaos-daemons",
    "detachment_rule_id": null,
    "enhancement_ids": [
      "false-majesty-aura-legion-of-excess",
      "dreaming-crown-aura-legion-of-excess",
      "avatar-of-perfection-legion-of-excess",
      "soul-glutton-legion-of-excess"
    ],
    "stratagem_ids": [
      "cavalcade-of-blades-legion-of-excess",
      "overwhelming-excess-legion-of-excess",
      "archagonists-legion-of-excess",
      "thieves-of-pain-legion-of-excess",
      "sensory-excruciation-legion-of-excess",
      "phantasmal-longing-legion-of-excess"
    ],
    "game_version": {
      "edition": "11th",
      "dataslate": "pre-launch-provisional"
    },
    "detachment_points": 2,
    "force_dispositions": [
      "priority-assets"
    ],
    "detachment_rule_ids": [
      "beguiling-aura",
      "seductive-gambit"
    ],
    "external_refs": [
      {
        "namespace": "mfm",
        "id": "e64491c2-1e38-485c-959c-2b0bdf2cffaa"
      }
    ]
  },
  {
    "id": "cavalcade-of-chaos",
    "name": "Cavalcade of Chaos",
    "faction_id": "chaos-daemons",
    "detachment_rule_id": "unholy-avalanche",
    "enhancement_ids": [
      "apocalyptic-steeds-upgrade-cavalcade-of-chaos",
      "soul-shattering-charge-upgrade-cavalcade-of-chaos"
    ],
    "stratagem_ids": [
      "from-beyond-the-veil-cavalcade-of-chaos",
      "warp-riders-cavalcade-of-chaos",
      "inescapable-manifestations-cavalcade-of-chaos"
    ],
    "game_version": {
      "edition": "11th",
      "dataslate": "pre-launch-provisional"
    },
    "detachment_points": 1,
    "force_dispositions": [
      "disruption"
    ],
    "external_refs": [
      {
        "namespace": "mfm",
        "id": "b3ac1391-84a9-4f8b-8755-d75eccfa5b70"
      }
    ]
  },
  {
    "id": "lords-of-the-warp",
    "name": "Lords of the Warp",
    "faction_id": "chaos-daemons",
    "detachment_rule_id": "loci-of-power",
    "enhancement_ids": [
      "swollen-with-power-upgrade-lords-of-the-warp"
    ],
    "stratagem_ids": [
      "carnival-of-excess-lords-of-the-warp",
      "call-to-murder-lords-of-the-warp",
      "bilious-blessing-lords-of-the-warp",
      "skirling-magicks-lords-of-the-warp"
    ],
    "game_version": {
      "edition": "11th",
      "dataslate": "pre-launch-provisional"
    },
    "detachment_points": 1,
    "force_dispositions": [
      "take-and-hold"
    ],
    "external_refs": [
      {
        "namespace": "mfm",
        "id": "fe916344-deef-4c81-99ed-2adae0a8c296"
      }
    ]
  },
  {
    "id": "warptide",
    "name": "Warptide",
    "faction_id": "chaos-daemons",
    "detachment_rule_id": "shudderblink",
    "enhancement_ids": [
      "bane-forged-weapons-upgrade-warptide",
      "soul-hungry-slaughterers-upgrade-warptide"
    ],
    "stratagem_ids": [
      "daemonic-infestation-warptide",
      "soulseeing-warptide",
      "incorporeal-entities-warptide"
    ],
    "game_version": {
      "edition": "11th",
      "dataslate": "pre-launch-provisional"
    },
    "detachment_points": 1,
    "force_dispositions": [
      "reconnaissance"
    ],
    "external_refs": [
      {
        "namespace": "mfm",
        "id": "bdbd5d64-bccf-4d77-bcac-2e19815d1516"
      }
    ]
  }
]
